{
  "$schema": "https://json-schema.org/draft/2020-12/schema",
  "$id": "https://theopenlane.io/schemas/workflow-definition.json",
  "$defs": {
    "ApprovalActionParams": {
      "$schema": "https://json-schema.org/draft/2020-12/schema",
      "$id": "https://github.com/theopenlane/core/v2/internal/workflows/approval-action-params",
      "properties": {
        "targets": {
          "items": {
            "properties": {
              "type": {
                "type": "string",
                "enum": [
                  "USER",
                  "GROUP",
                  "ROLE",
                  "RESOLVER",
                  "CHANNEL"
                ]
              },
              "id": {
                "type": "string"
              },
              "resolver_key": {
                "type": "string"
              },
              "destination": {
                "type": "string"
              }
            },
            "additionalProperties": false,
            "type": "object"
          },
          "type": "array",
          "description": "List of users, groups, roles, or resolvers who can approve"
        },
        "required": {
          "type": "boolean",
          "description": "Whether this approval is required for workflow completion (defaults to true)"
        },
        "label": {
          "type": "string",
          "description": "Optional display label for the approval action"
        },
        "required_count": {
          "type": "integer",
          "description": "Number of approvals needed (quorum threshold); 0 means all targets must approve"
        },
        "fields": {
          "items": {
            "type": "string"
          },
          "type": "array",
          "description": "Fields that are gated by this approval action (used for domain derivation)"
        }
      },
      "additionalProperties": false,
      "type": "object",
      "title": "ApprovalActionParams",
      "description": "Parameters for REQUEST_APPROVAL actions that require user or group approval"
    },
    "CreateObjectActionParams": {
      "$schema": "https://json-schema.org/draft/2020-12/schema",
      "$id": "https://github.com/theopenlane/core/v2/internal/workflows/create-object-action-params",
      "properties": {
        "object_type": {
          "type": "string",
          "description": "The schema type to create (e.g., Task, Review, Finding, Vulnerability)"
        },
        "fields": {
          "type": "object",
          "description": "Field values to apply to the new object"
        },
        "link_to_trigger": {
          "type": "boolean",
          "description": "Whether to attach the created object to the triggering object when supported"
        }
      },
      "additionalProperties": false,
      "type": "object",
      "title": "CreateObjectActionParams",
      "description": "Parameters for CREATE_OBJECT actions that create new objects"
    },
    "FieldUpdateActionParams": {
      "$schema": "https://json-schema.org/draft/2020-12/schema",
      "$id": "https://github.com/theopenlane/core/v2/internal/workflows/field-update-action-params",
      "properties": {
        "updates": {
          "type": "object",
          "description": "Map of field names to new values to apply"
        }
      },
      "additionalProperties": false,
      "type": "object",
      "title": "FieldUpdateActionParams",
      "description": "Parameters for UPDATE_FIELD actions that modify object fields"
    },
    "IntegrationActionParams": {
      "$schema": "https://json-schema.org/draft/2020-12/schema",
      "$id": "https://github.com/theopenlane/core/v2/internal/workflows/integration-action-params",
      "properties": {
        "installation_id": {
          "type": "string"
        },
        "definition_id": {
          "type": "string"
        },
        "operation_name": {
          "type": "string",
          "description": "Exact operation name criteria for integration target resolution"
        },
        "config": {
          "description": "Integration-specific configuration payload"
        },
        "scope_expression": {
          "type": "string",
          "description": "Optional CEL condition that gates whether the integration action should execute"
        },
        "scope_payload": {
          "description": "Optional scope payload exposed to scope_expression evaluation"
        },
        "scope_resource": {
          "type": "string",
          "description": "Optional scope resource identity exposed to scope_expression evaluation"
        },
        "force_client_rebuild": {
          "type": "boolean"
        }
      },
      "additionalProperties": false,
      "type": "object",
      "title": "IntegrationActionParams",
      "description": "Parameters for INTEGRATION actions that interact with external systems"
    },
    "NotificationActionParams": {
      "$schema": "https://json-schema.org/draft/2020-12/schema",
      "$id": "https://github.com/theopenlane/core/v2/internal/workflows/notification-action-params",
      "properties": {
        "targets": {
          "items": {
            "properties": {
              "type": {
                "type": "string",
                "enum": [
                  "USER",
                  "GROUP",
                  "ROLE",
                  "RESOLVER",
                  "CHANNEL"
                ]
              },
              "id": {
                "type": "string"
              },
              "resolver_key": {
                "type": "string"
              },
              "destination": {
                "type": "string"
              }
            },
            "additionalProperties": false,
            "type": "object"
          },
          "type": "array",
          "description": "List of message targets: USER/GROUP/ROLE/RESOLVER for user-directed notifications"
        },
        "topic": {
          "type": "string",
          "description": "Optional notification topic for categorization"
        },
        "title": {
          "type": "string",
          "description": "Notification title"
        },
        "body": {
          "type": "string",
          "description": "Notification body content"
        },
        "data": {
          "type": "object",
          "description": "Optional additional data to include in the notification payload"
        }
      },
      "additionalProperties": false,
      "type": "object",
      "title": "NotificationActionParams",
      "description": "Parameters for NOTIFY actions that send notifications to users"
    },
    "ReviewActionParams": {
      "$schema": "https://json-schema.org/draft/2020-12/schema",
      "$id": "https://github.com/theopenlane/core/v2/internal/workflows/review-action-params",
      "properties": {
        "targets": {
          "items": {
            "properties": {
              "type": {
                "type": "string",
                "enum": [
                  "USER",
                  "GROUP",
                  "ROLE",
                  "RESOLVER",
                  "CHANNEL"
                ]
              },
              "id": {
                "type": "string"
              },
              "resolver_key": {
                "type": "string"
              },
              "destination": {
                "type": "string"
              }
            },
            "additionalProperties": false,
            "type": "object"
          },
          "type": "array",
          "description": "List of users, groups, roles, or resolvers who can review"
        },
        "required": {
          "type": "boolean",
          "description": "Whether this review is required for workflow completion (defaults to true)"
        },
        "label": {
          "type": "string",
          "description": "Optional display label for the review action"
        },
        "required_count": {
          "type": "integer",
          "description": "Number of reviews needed (quorum threshold); 0 means all targets must review"
        }
      },
      "additionalProperties": false,
      "type": "object",
      "title": "ReviewActionParams",
      "description": "Parameters for REQUEST_REVIEW actions that require user or group review"
    },
    "SendEmailActionParams": {
      "$schema": "https://json-schema.org/draft/2020-12/schema",
      "$id": "https://github.com/theopenlane/core/v2/internal/workflows/send-email-action-params",
      "properties": {
        "targets": {
          "items": {
            "properties": {
              "type": {
                "type": "string",
                "enum": [
                  "USER",
                  "GROUP",
                  "ROLE",
                  "RESOLVER",
                  "CHANNEL"
                ]
              },
              "id": {
                "type": "string"
              },
              "resolver_key": {
                "type": "string"
              },
              "destination": {
                "type": "string"
              }
            },
            "additionalProperties": false,
            "type": "object"
          },
          "type": "array"
        },
        "emailTemplateId": {
          "type": "string"
        },
        "emailTemplateKey": {
          "type": "string"
        },
        "to": {
          "items": {
            "type": "string"
          },
          "type": "array"
        },
        "from": {
          "type": "string"
        },
        "replyTo": {
          "type": "string"
        }
      },
      "additionalProperties": false,
      "type": "object"
    },
    "TargetConfig": {
      "$schema": "https://json-schema.org/draft/2020-12/schema",
      "$id": "https://github.com/theopenlane/core/v2/internal/workflows/target-config",
      "properties": {
        "type": {
          "type": "string",
          "enum": [
            "USER",
            "GROUP",
            "ROLE",
            "RESOLVER",
            "CHANNEL"
          ],
          "description": "Target type: USER (specific user), GROUP (group members), ROLE (role holders), or RESOLVER (dynamic resolution)"
        },
        "id": {
          "type": "string",
          "description": "The ID of the target user, group, or role (required for USER, GROUP, ROLE types)"
        },
        "resolver_key": {
          "type": "string",
          "description": "The resolver key for dynamic target resolution (required for RESOLVER type)"
        },
        "destination": {
          "type": "string"
        }
      },
      "additionalProperties": false,
      "type": "object",
      "title": "TargetConfig",
      "description": "Defines who should receive workflow actions"
    },
    "WebhookActionParams": {
      "$schema": "https://json-schema.org/draft/2020-12/schema",
      "$id": "https://github.com/theopenlane/core/v2/internal/workflows/webhook-action-params",
      "properties": {
        "url": {
          "type": "string",
          "description": "The webhook endpoint URL"
        },
        "method": {
          "type": "string",
          "description": "HTTP method (GET, POST, PUT, DELETE, etc.)"
        },
        "headers": {
          "additionalProperties": {
            "type": "string"
          },
          "type": "object",
          "description": "Additional HTTP headers to include in the request"
        },
        "payload_expr": {
          "type": "string",
          "description": "CEL expression that evaluates to additional data merged into the webhook payload"
        },
        "timeout_ms": {
          "type": "integer",
          "description": "Request timeout in milliseconds"
        },
        "secret": {
          "type": "string",
          "description": "Secret key for signing the webhook payload (HMAC-SHA256)"
        },
        "retries": {
          "type": "integer",
          "description": "Number of retry attempts on failure"
        },
        "idempotency_key": {
          "type": "string",
          "description": "Optional idempotency key header override"
        }
      },
      "additionalProperties": false,
      "type": "object",
      "title": "WebhookActionParams",
      "description": "Parameters for WEBHOOK actions that call external HTTP endpoints"
    },
    "WorkflowAction": {
      "properties": {
        "key": {
          "type": "string",
          "description": "Unique key identifying this action within the workflow"
        },
        "type": {
          "type": "string",
          "enum": [
            "REQUEST_APPROVAL",
            "NOTIFY",
            "WEBHOOK",
            "UPDATE_FIELD",
            "INTEGRATION",
            "REASSIGN_APPROVAL",
            "SEND_EMAIL",
            "CREATE_OBJECT",
            "REQUEST_REVIEW"
          ],
          "description": "Action type: REQUEST_APPROVAL, REQUEST_REVIEW, NOTIFY, WEBHOOK, UPDATE_FIELD, INTEGRATION, or CREATE_OBJECT"
        },
        "params": {
          "description": "Action-specific parameters. Schema depends on the action type:\n- REQUEST_APPROVAL: ApprovalActionParams\n- REQUEST_REVIEW: ReviewActionParams\n- NOTIFY: NotificationActionParams\n- WEBHOOK: WebhookActionParams\n- UPDATE_FIELD: FieldUpdateActionParams\n- INTEGRATION: IntegrationActionParams\n- CREATE_OBJECT: CreateObjectActionParams"
        },
        "when": {
          "type": "string",
          "description": "Optional CEL expression to conditionally execute this action"
        },
        "description": {
          "type": "string",
          "description": "Human-readable description of what this action does"
        }
      },
      "additionalProperties": false,
      "type": "object",
      "description": "Represents an action performed by the workflow"
    },
    "WorkflowCondition": {
      "properties": {
        "expression": {
          "type": "string"
        },
        "description": {
          "type": "string"
        }
      },
      "additionalProperties": false,
      "type": "object"
    },
    "WorkflowSelector": {
      "properties": {
        "tagIds": {
          "items": {
            "type": "string"
          },
          "type": "array"
        },
        "groupIds": {
          "items": {
            "type": "string"
          },
          "type": "array"
        },
        "objectTypes": {
          "items": {
            "type": "string",
            "enum": [
              "ActionPlan",
              "Assessment",
              "AssessmentResponse",
              "Campaign",
              "CampaignTarget",
              "Control",
              "Evidence",
              "Finding",
              "IdentityHolder",
              "InternalPolicy",
              "Platform",
              "Procedure",
              "Remediation",
              "Risk",
              "Subcontrol",
              "Task",
              "Vulnerability"
            ],
            "description": "The object type the workflow applies to"
          },
          "type": "array"
        }
      },
      "additionalProperties": false,
      "type": "object"
    },
    "WorkflowTrigger": {
      "properties": {
        "operation": {
          "type": "string"
        },
        "interval": {
          "type": "string"
        },
        "objectType": {
          "type": "string",
          "enum": [
            "ActionPlan",
            "Assessment",
            "AssessmentResponse",
            "Campaign",
            "CampaignTarget",
            "Control",
            "Evidence",
            "Finding",
            "IdentityHolder",
            "InternalPolicy",
            "Platform",
            "Procedure",
            "Remediation",
            "Risk",
            "Subcontrol",
            "Task",
            "Vulnerability"
          ]
        },
        "fields": {
          "items": {
            "type": "string"
          },
          "type": "array"
        },
        "edges": {
          "items": {
            "type": "string"
          },
          "type": "array"
        },
        "selector": {
          "$ref": "#/$defs/WorkflowSelector"
        },
        "expression": {
          "type": "string"
        },
        "description": {
          "type": "string"
        }
      },
      "additionalProperties": false,
      "type": "object"
    }
  },
  "properties": {
    "name": {
      "type": "string"
    },
    "description": {
      "type": "string"
    },
    "schemaType": {
      "type": "string"
    },
    "workflowKind": {
      "type": "string",
      "enum": [
        "APPROVAL",
        "LIFECYCLE",
        "NOTIFICATION"
      ]
    },
    "approvalSubmissionMode": {
      "type": "string",
      "enum": [
        "MANUAL_SUBMIT",
        "AUTO_SUBMIT"
      ]
    },
    "approvalTiming": {
      "type": "string",
      "enum": [
        "PRE_COMMIT",
        "POST_COMMIT"
      ]
    },
    "version": {
      "type": "string"
    },
    "targets": {
      "$ref": "#/$defs/WorkflowSelector"
    },
    "triggers": {
      "items": {
        "$ref": "#/$defs/WorkflowTrigger"
      },
      "type": "array"
    },
    "conditions": {
      "items": {
        "$ref": "#/$defs/WorkflowCondition"
      },
      "type": "array"
    },
    "actions": {
      "items": {
        "$ref": "#/$defs/WorkflowAction"
      },
      "type": "array"
    },
    "metadata": {
      "type": "object"
    }
  },
  "additionalProperties": false,
  "type": "object",
  "title": "Workflow Definition",
  "description": "Schema for Openlane workflow definitions"
}